Publication Type,Authors,Book Authors,Book Editors,Book Group Authors,Author Full Names,Book Author Full Names,Group Authors,Article Title,Source Title,Book Series Title,Book Series Subtitle,Language,Document Type,Conference Title,Conference Date,Conference Location,Conference Sponsor,Conference Host,Author Keywords,Keywords Plus,Abstract,Addresses,Reprint Addresses,Email Addresses,Researcher Ids,ORCIDs,Funding Orgs,Funding Text,Cited References,Cited Reference Count,"Times Cited, WoS Core","Times Cited, All Databases",180 Day Usage Count,Since 2013 Usage Count,Publisher,Publisher City,Publisher Address,ISSN,eISSN,ISBN,Journal Abbreviation,Journal ISO Abbreviation,Publication Date,Publication Year,Volume,Issue,Part Number,Supplement,Special Issue,Meeting Abstract,Start Page,End Page,Article Number,DOI,Book DOI,Early Access Date,Number of Pages,WoS Categories,Research Areas,IDS Number,UT (Unique WOS ID),Pubmed Id,Open Access Designations,Highly Cited Status,Hot Paper Status,Date of Export,
J,"Tian, H; Trozzi, F; Zoltowski, BD; Tao, P",,,,"Tian, Hao; Trozzi, Francesco; Zoltowski, Brian D.; Tao, Peng",,,Deciphering the Allosteric Process of the Phaeodactylum tricornutum Aureochrome 1a LOV Domain,JOURNAL OF PHYSICAL CHEMISTRY B,,,English,Article,,,,,,,LIGHT; DIMERIZATION; FRAMEWORK; MODELS; INSIGHTS; OPENMM; OXYGEN,"The conformational-driven allosteric protein diatom Phaeodactylum tricornutum aureochrome 1a (PtAu1a) differs from other light-oxygen-voltage (LOV) proteins for its uncommon structural topology. The mechanism of signaling transduction in the PtAu1a LOV domain (AuLOV) including flanking helices remains unclear because of this dissimilarity, which hinders the study of PtAu1a as an optogenetic tool. To clarify this mechanism, we employed a combination of tree-based machine learning models, Markov state models, machine-learning-based community analysis, and transition path theory to quantitatively analyze the allosteric process. Our results are in good agreement with the reported experimental findings and reveal a previously overlooked C alpha helix and protein linkers as important in promoting the protein conformational changes. This integrated approach can be considered as a general workflow and applied on other allosteric proteins to provide detailed information about their allosteric mechanisms.","[Tian, Hao; Trozzi, Francesco; Zoltowski, Brian D.; Tao, Peng] Southern Methodist Univ, Ctr Drug Discovery Design & Delivery CD4, Ctr Res Comp, Dept Chem, Dallas, TX 75275 USA","Tao, P (corresponding author), Southern Methodist Univ, Ctr Drug Discovery Design & Delivery CD4, Ctr Res Comp, Dept Chem, Dallas, TX 75275 USA.",ptao@smu.edu,"Tao, Peng/H-4925-2014","Tao, Peng/0000-0002-2488-0239; Tian, Hao/0000-0002-0186-9811","NIHUnited States Department of Health & Human ServicesNational Institutes of Health (NIH) - USA [R15GM122013, R15GM109282]","We gratefully acknowledge funding sources, including NIH research grant R15GM122013 to P.T. and NIH research grant R15GM109282 to B.D.Z. Computational time was generously provided by Southern Methodist University's Center for Research Computing. The authors thank Ms. Xi Jiang from the Biostatistics Ph.D. program in the Statistics department of SMU for fruitful discussions.",,67,0,0,1,1,AMER CHEMICAL SOC,WASHINGTON,"1155 16TH ST, NW, WASHINGTON, DC 20036 USA",1520-6106,1520-5207,,J PHYS CHEM B,J. Phys. Chem. B,OCT 15,2020,124,41,,,,,8960,8972,,10.1021/acs.jpcb.0c05842,,,13,"Chemistry, Physical",Chemistry,OH4TU,WOS:000582569100002,32970438,,,,2020-11-19,
J,"Peng, SJ; Wang, XW; Zhang, L; He, SS; Zhao, XS; Huang, XH; Chen, CL",,,,"Peng, Sijia; Wang, Xiaowei; Zhang, Lu; He, Shanshan; Zhao, Xin Sheng; Huang, Xuhui; Chen, Chunlai",,,Target search and recognition mechanisms of glycosylase AlkD revealed by scanning FRET-FCS and Markov state models,PROCEEDINGS OF THE NATIONAL ACADEMY OF SCIENCES OF THE UNITED STATES OF AMERICA,,,English,Article,,,,,,Markov state model; protein dynamics; molecular dynamics simulations; single-molecule fluorescence; fluorescence correlation spectroscopy,CONFORMATIONAL DYNAMICS; DNA GLYCOSYLASES; RNA-POLYMERASE; REPAIR; PROTEINS; DIFFUSION; DAMAGE; SUPERFAMILY; EXCISION; AFFINITY,"DNA glycosylase is responsible for repairing DNA damage to maintain the genome stability and integrity. However, how glycosylase can efficiently and accurately recognize DNA lesions across the enormous DNA genome remains elusive. It has been hypothesized that glycosylase translocates along the DNA by alternating between a fast but low-accuracy diffusion mode and a slow but high-accuracy mode when searching for DNA lesions. However, the slow mode has not been successfully characterized due to the limitation in the spatial and temporal resolutions of current experimental techniques. Using a newly developed scan- ning fluorescence resonance energy transfer (FRET)-fluorescence correlation spectroscopy (FCS) platform, we were able to observe both slow and fast modes of glycosylase AlkD translocating on double-stranded DNA (dsDNA), reaching the temporal resolution of microsecond and spatial resolution of subnanometer. The underlying molecular mechanism of the slow mode was further elucidated by Markov state model built from extensive all-atom molecular dynamics simulations. We found that in the slow mode, AIkD follows an asymmetric diffusion pathway, i.e., rotation fol- lowed by translation. Furthermore, the essential role of Y27 in AlkD diffusion dynamics was identified both experimentally and computationally. Our results provided mechanistic insights on how conformational dynamics of AlkD-dsDNA complex coordinate different diffusion modes to accomplish the search for DNA lesions with high efficiency and accuracy. We anticipate that the mechanism adopted by AlkD to search for DNA lesions could be a general one utilized by other glycosylases and DNA binding proteins.","[Peng, Sijia; Chen, Chunlai] Tsinghua Univ, Beijing Adv Innovat Ctr Struct Biol, Beijing Frontier Res Ctr Biol Struct, Sch Life Sci,Tsinghua Peking Joint Ctr Life Sc, Beijing 100084, Peoples R China; [Wang, Xiaowei; Huang, Xuhui] Hong Kong Univ Sci & Technol, Ctr Syst Biol & Human Hlth, State Key Lab Mol Neurosci, Dept Chem,Kowloon, Hong Kong 999077, Peoples R China; [Zhang, Lu] Chinese Acad Sci, State Key Lab Struct Chem, Fujian Inst Res Struct Matter, Fuzhou 350002, Fujian, Peoples R China; [He, Shanshan; Zhao, Xin Sheng] Peking Univ, State Key Lab Struct Chem Unstable & Stable Speci, Beijing Natl Lab Mol Sci, Dept Chem Biol,Coll Chem & Mol Engn, Beijing 100871, Peoples R China; [He, Shanshan; Zhao, Xin Sheng] Peking Univ, Biomed Pioneering Innovat Ctr, Beijing 100871, Peoples R China; [Zhang, Lu] Univ Chinese Acad Sci, Beijing 100049, Peoples R China","Chen, CL (corresponding author), Tsinghua Univ, Beijing Adv Innovat Ctr Struct Biol, Beijing Frontier Res Ctr Biol Struct, Sch Life Sci,Tsinghua Peking Joint Ctr Life Sc, Beijing 100084, Peoples R China.; Huang, XH (corresponding author), Hong Kong Univ Sci & Technol, Ctr Syst Biol & Human Hlth, State Key Lab Mol Neurosci, Dept Chem,Kowloon, Hong Kong 999077, Peoples R China.; Zhang, L (corresponding author), Chinese Acad Sci, State Key Lab Struct Chem, Fujian Inst Res Struct Matter, Fuzhou 350002, Fujian, Peoples R China.; Zhao, XS (corresponding author), Peking Univ, State Key Lab Struct Chem Unstable & Stable Speci, Beijing Natl Lab Mol Sci, Dept Chem Biol,Coll Chem & Mol Engn, Beijing 100871, Peoples R China.; Zhao, XS (corresponding author), Peking Univ, Biomed Pioneering Innovat Ctr, Beijing 100871, Peoples R China.; Zhang, L (corresponding author), Univ Chinese Acad Sci, Beijing 100049, Peoples R China.",luzhang@fjirsm.ac.cn; zhaoxs@pku.edu.cn; xuhuihuang@ust.hk; chunlai@mail.tsinghua.edu.cn,,"Huang, Xuhui/0000-0002-7119-9358; Zhang, Lu/0000-0002-8640-1301","National Natural Science Foundation of ChinaNational Natural Science Foundation of China (NSFC) [21922704, 21877069, 31570754, 21233002, 21521003, 21733007, 21803071]; National 1000 Youth Talents Program of China; Hong Kong Research Grant CouncilHong Kong Research Grants Council [16307718, 16318816, AoE/P-705/16, T13-605/18-W]","This project was supported by funds from the National Natural Science Foundation of China (Grants 21922704, 21877069, and 31570754 to C.C.; 21233002 and 21521003 to X.S.Z.; and 21733007 and 21803071 to L.Z.), the National 1000 Youth Talents Program of China to L.Z., and Hong Kong Research Grant Council (Grants 16307718, 16318816, AoE/P-705/16, and T13-605/18-W to X.H.).",,67,0,0,1,1,NATL ACAD SCIENCES,WASHINGTON,"2101 CONSTITUTION AVE NW, WASHINGTON, DC 20418 USA",0027-8424,,,P NATL ACAD SCI USA,Proc. Natl. Acad. Sci. U. S. A.,SEP 8,2020,117,36,,,,,21889,21895,,10.1073/pnas.2002971117,,,7,Multidisciplinary Sciences,Science & Technology - Other Topics,NT5FU,WOS:000572967300014,32820079,"Green Published, Other Gold",,,2020-11-19,
J,"Lazim, R; Suh, D; Choi, S",,,,"Lazim, Raudah; Suh, Donghyuk; Choi, Sun",,,Advances in Molecular Dynamics Simulations and Enhanced Sampling Methods for the Study of Protein Systems,INTERNATIONAL JOURNAL OF MOLECULAR SCIENCES,,,English,Review,,,,,,molecular dynamics simulation; enhanced sampling; protein-protein interactions; binding free energy; protein-ligand binding affinity,POLARIZABLE FORCE-FIELD; REPLICA-EXCHANGE METHOD; MARKOV STATE MODELS; BINDING FREE-ENERGY; EQUATION-OF-STATE; INTERACTION ENTROPY; DRUG DISCOVERY; RARE EVENTS; HOT-SPOTS; ACCURATE,"Molecular dynamics (MD) simulation is a rigorous theoretical tool that when used efficiently could provide reliable answers to questions pertaining to the structure-function relationship of proteins. Data collated from protein dynamics can be translated into useful statistics that can be exploited to sieve thermodynamics and kinetics crucial for the elucidation of mechanisms responsible for the modulation of biological processes such as protein-ligand binding and protein-protein association. Continuous modernization of simulation tools enables accurate prediction and characterization of the aforementioned mechanisms and these qualities are highly beneficial for the expedition of drug development when effectively applied to structure-based drug design (SBDD). In this review, current all-atom MD simulation methods, with focus on enhanced sampling techniques, utilized to examine protein structure, dynamics, and functions are discussed. This review will pivot around computer calculations of protein-ligand and protein-protein systems with applications to SBDD. In addition, we will also be highlighting limitations faced by current simulation tools as well as the improvements that have been made to ameliorate their efficiency.","[Choi, Sun] Ewha Womans Univ, Coll Pharm, Seoul 03760, South Korea; Ewha Womans Univ, Grad Sch Pharmaceut Sci, Seoul 03760, South Korea","Choi, S (corresponding author), Ewha Womans Univ, Coll Pharm, Seoul 03760, South Korea.",raudah@ewha.ac.kr; dsuh@ewha.ac.kr; sunchoi@ewha.ac.kr,,"Choi, Sun/0000-0002-7669-7954","Bio and Medical Technology Development Program - Ministry of Science and ICT (MSIT) [NRF-2019M3E5D4065251]; Ministry of Health and Welfare (MOHW) through the National Research Foundation of Korea (NRF), Medical Research Center (MRC) grant [2018R1A5A2025286]; Ministry of Health and Welfare (MOHW) through the Mid-career Researcher Program [NRF-2017R1A2B4010084]; RP-Grant 2020 of EwhaWomans University","This work was supported by Bio and Medical Technology Development Program (NRF-2019M3E5D4065251) funded by the Ministry of Science and ICT (MSIT) and the Ministry of Health and Welfare (MOHW) through the National Research Foundation of Korea (NRF), Medical Research Center (MRC) grant (No. 2018R1A5A2025286), and the Mid-career Researcher Program (NRF-2017R1A2B4010084). It was also supported by RP-Grant 2020 of EwhaWomans University.",,153,0,0,4,4,MDPI,BASEL,"ST ALBAN-ANLAGE 66, CH-4052 BASEL, SWITZERLAND",,1422-0067,,INT J MOL SCI,Int. J. Mol. Sci.,SEP,2020,21,17,,,,,,,6339,10.3390/ijms21176339,,,20,"Biochemistry & Molecular Biology; Chemistry, Multidisciplinary",Biochemistry & Molecular Biology; Chemistry,NQ9UB,WOS:000571210400001,32882859,"DOAJ Gold, Green Published",,,2020-11-19,
J,"Gkeka, P; Stoltz, G; Farimani, AB; Belkacemi, Z; Ceriotti, M; Chodera, JD; Dinner, AR; Ferguson, AL; Maillet, JB; Minoux, H; Peter, C; Pietrucci, F; Silveira, A; Tkatchenko, A; Trstanova, Z; Wiewiora, R; Lelievre, T",,,,"Gkeka, Paraskevi; Stoltz, Gabriel; Farimani, Amir Barati; Belkacemi, Zineb; Ceriotti, Michele; Chodera, John D.; Dinner, Aaron R.; Ferguson, Andrew L.; Maillet, Jean-Bernard; Minoux, Herve; Peter, Christine; Pietrucci, Fabio; Silveira, Ana; Tkatchenko, Alexandre; Trstanova, Zofia; Wiewiora, Rafal; Lelievre, Tony",,,Machine Learning Force Fields and Coarse-Grained Variables in Molecular Dynamics: Application to Materials and Biological Systems,JOURNAL OF CHEMICAL THEORY AND COMPUTATION,,,English,Article,,,,,,,FREE-ENERGY LANDSCAPES; NONLINEAR DIMENSIONALITY REDUCTION; INDEPENDENT COMPONENT ANALYSIS; DER-WAALS INTERACTIONS; VARIATIONAL APPROACH; COHERENT STRUCTURES; RELAXATION MODES; MARKOV-MODELS; SIMULATIONS; KINETICS,"Machine learning encompasses tools and algorithms that are now becoming popular in almost all scientific and technological fields. This is true for molecular dynamics as well, where machine learning offers promises of extracting valuable information from the enormous amounts of data generated by simulation of complex systems. We provide here a review of our current understanding of goals, benefits, and limitations of machine learning techniques for computational studies on atomistic systems, focusing on the construction of empirical force fields from ab initio databases and the determination of reaction coordinates for free energy computation and enhanced sampling.","[Gkeka, Paraskevi; Belkacemi, Zineb] Sanofi R&D, Integrated Drug Discovery, F-91385 Chilly Mazarin, France; [Stoltz, Gabriel; Belkacemi, Zineb; Lelievre, Tony] Ecole Ponts, CERMICS, F-75012 Marne La Vallee, France; [Stoltz, Gabriel; Lelievre, Tony] Inria Paris, Matherials Project Team, F-75012 Paris, France; [Farimani, Amir Barati] Carnegie Mellon Univ, Pittsburgh, PA 15213 USA; [Ceriotti, Michele] Ecole Polytech Fed Lausanne, Lab Computat Sci & Modelling, Inst Mat, CH-1015 Lausanne, Switzerland; [Chodera, John D.; Silveira, Ana; Wiewiora, Rafal] Mem Sloan Kettering Canc Ctr, Computat & Syst Biol Program, Sloan Kettering Inst, New York, NY 10065 USA; [Dinner, Aaron R.] Univ Chicago, Dept Chem, 5735 S Ellis Ave, Chicago, IL 60637 USA; [Ferguson, Andrew L.] Univ Chicago, Pritzker Sch Mol Engn, Chicago, IL 60637 USA; [Maillet, Jean-Bernard] CEA DAM, DIF, F-91297 Arpajon, France; [Minoux, Herve] Sanofi R&D, Integrated Drug Discovery, F-94403 Vitry Sur Seine, France; [Peter, Christine] Univ Konstanz, D-78457 Constance, Germany; [Pietrucci, Fabio] Sorbonne Univ, MNHN, UMR CNRS 7590, Inst Mineral Phys Mat & Cosmochim, F-75005 Paris, France; [Tkatchenko, Alexandre] Univ Luxembourg, Dept Phys & Mat Sci, L-1511 Luxembourg, Luxembourg; [Trstanova, Zofia] Univ Edinburgh, Sch Math, Edinburgh EH9 3FD, Midlothian, Scotland","Gkeka, P (corresponding author), Sanofi R&D, Integrated Drug Discovery, F-91385 Chilly Mazarin, France.; Stoltz, G; Lelievre, T (corresponding author), Ecole Ponts, CERMICS, F-75012 Marne La Vallee, France.; Stoltz, G; Lelievre, T (corresponding author), Inria Paris, Matherials Project Team, F-75012 Paris, France.",Paraskevi.Gkeka@sanofi.com; gabriel.stoltz@enpc.fr; tony.lelievre@enpc.fr,"Ceriotti, Michele/C-2393-2009; Barati Farimani, Amir/F-2356-2013","Ceriotti, Michele/0000-0003-2571-2832; Dinner, Aaron/0000-0001-8328-6427; Ferguson, Andrew/0000-0002-8829-9726; Barati Farimani, Amir/0000-0002-2952-8576; Chodera, John/0000-0003-0542-119X",,,,228,2,2,18,18,AMER CHEMICAL SOC,WASHINGTON,"1155 16TH ST, NW, WASHINGTON, DC 20036 USA",1549-9618,1549-9626,,J CHEM THEORY COMPUT,J. Chem. Theory Comput.,AUG 11,2020,16,8,,,,,4757,4775,,10.1021/acs.jctc.0c00355,,,19,"Chemistry, Physical; Physics, Atomic, Molecular & Chemical",Chemistry; Physics,ND8FT,WOS:000562139200001,32559068,,,,2020-11-19,
J,"Zhang, L; Wu, SW; Feng, YT; Wang, D; Jia, XL; Liu, ZJ; Liu, JW; Wang, WN",,,,"Zhang, Lu; Wu, Shaowen; Feng, Yitao; Wang, Dan; Jia, Xilin; Liu, Zhijun; Liu, Jianwei; Wang, Wenning",,,Ligand-bound glutamine binding protein assumes multiple metastable binding sites with different binding affinities,COMMUNICATIONS BIOLOGY,,,English,Article,,,,,,,MARKOV STATE MODELS; SINGLE-MOLECULE FRET; CONFORMATIONAL SELECTION; INDUCED FIT; MALTOSE-BINDING; ACTIVE-TRANSPORT; ESCHERICHIA-COLI; FOLDING KINETICS; DYNAMICS; SPECIFICITY,"Protein dynamics plays key roles in ligand binding. However, the microscopic description of conformational dynamics-coupled ligand binding remains a challenge. In this study, we integrate molecular dynamics simulations, Markov state model (MSM) analysis and experimental methods to characterize the conformational dynamics of ligand-bound glutamine binding protein (GlnBP). We show that ligand-bound GlnBP has high conformational flexibility and additional metastable binding sites, presenting a more complex energy landscape than the scenario in the absence of ligand. The diverse conformations of GlnBP demonstrate different binding affinities and entail complex transition kinetics, implicating a concerted ligand binding mechanism. Single molecule fluorescence resonance energy transfer measurements and mutagenesis experiments are performed to validate our MSM-derived structure ensemble as well as the binding mechanism. Collectively, our study provides deeper insights into the protein dynamics-coupled ligand binding, revealing an intricate regulatory network underlying the apparent binding affinity. Zhang, Wu, Feng et al. show that ligand-bound glutamine binding protein assumes multiple metastable binding sites, presenting a more dynamic energy landscape than its ligand-free form. This study provides insights into the ligand-binding mechanisms coupled with protein dynamics that underly the apparent binding affinity.","[Zhang, Lu; Jia, Xilin] Chinese Acad Sci, Fujian Inst Res Struct Matter, State Key Lab Struct Chem, Fuzhou, Fujian, Peoples R China; [Wu, Shaowen; Feng, Yitao; Wang, Dan; Liu, Jianwei; Wang, Wenning] Fudan Univ, Inst Biomed Sci, Dept Chem, Multiscale Res Inst Complex Syst, Shanghai, Peoples R China; [Jia, Xilin] Univ Chinese Acad Sci, Beijing, Peoples R China; [Liu, Zhijun] Chinese Acad Sci, Natl Ctr Prot Sci, Shanghai Inst Biochem & Cell Biol, Shanghai, Peoples R China","Zhang, L (corresponding author), Chinese Acad Sci, Fujian Inst Res Struct Matter, State Key Lab Struct Chem, Fuzhou, Fujian, Peoples R China.; Wang, WN (corresponding author), Fudan Univ, Inst Biomed Sci, Dept Chem, Multiscale Res Inst Complex Syst, Shanghai, Peoples R China.",luzhang@fjirsm.ac.cn; wnwang@fudan.edu.cn,,"Zhang, Lu/0000-0002-8640-1301","National Natural Science Foundation of ChinaNational Natural Science Foundation of China (NSFC) [21733007, 21803071, 21773038]; National 1000 Youth Talents Program of China; Ministry of Science and Technology of the People's Republic of ChinaMinistry of Science and Technology, China [2016YFA0501702]","We thank the National Natural Science Foundation of China Grants (21733007, 21803071 (to L.Z.) and 21773038 (to W.W.), the National 1000 Youth Talents Program of China (to L.Z.), and the Ministry of Science and Technology of the People's Republic of China (2016YFA0501702 (to W.W.)) for the financial support. We acknowledge the insightful discussions with Prof. Xuhui Huang and Dr. Siqin Cao.",,91,0,0,4,4,NATURE PUBLISHING GROUP,NEW YORK,"75 VARICK ST, 9TH FLR, NEW YORK, NY 10013-1917 USA",,2399-3642,,COMMUN BIOL,Commun. Biol.,AUG 3,2020,3,1,,,,,,,419,10.1038/s42003-020-01149-z,,,11,Biology; Multidisciplinary Sciences,Life Sciences & Biomedicine - Other Topics; Science & Technology - Other Topics,NB2NY,WOS:000560350900002,32747735,"DOAJ Gold, Green Published",,,2020-11-19,
J,"Tian, H; Tao, P",,,,"Tian, Hao; Tao, Peng",,,Deciphering the protein motion of S1 subunit in SARS-CoV-2 spike glycoprotein through integrated computational methods,JOURNAL OF BIOMOLECULAR STRUCTURE & DYNAMICS,,,English,Article; Early Access,,,,,,SARS-CoV-2; spike glycoprotein; Markov state model; random forest; transition path theory,COV; CORONAVIRUSES; MODELS; JUMP,"The novel severe acute respiratory syndrome coronavirus 2 (SARS-CoV-2) is a major worldwide public health emergency that has infected over 8 million people. Spike glycoprotein, especially the partially open state of S1 subunit, in SARS-CoV-2 is considered vital for its infection with human host cell. However, the mechanism elucidating the transition from the closed state to the partially open state still remains unclear. In this study, we applied a series of computational methods, including Markov state model, transition path theory and random forest to analyze the S1 motion. Our results showed a promising complete conformational movement of the receptor-binding domain, from buried, partially open, to detached states. We also estimated the transition probability among these states. Based on the asymmetry in both the dynamics behavior and the accumulated alpha carbon (C alpha) importance, we further suggested a relation among chains in the trimer spike protein, which leads to a deeper understanding on protein motions of the S1 subunit. Communicated by Ramaswamy H. Sarma","[Tian, Hao; Tao, Peng] Southern Methodist Univ, Ctr Drug Discovery Design & Delivery CD4, Ctr Res Comp, Dept Chem, Dallas, TX 75205 USA","Tao, P (corresponding author), Southern Methodist Univ, Ctr Drug Discovery Design & Delivery CD4, Ctr Res Comp, Dept Chem, Dallas, TX 75205 USA.",ptao@smu.edu,"Tian, Hao/AAZ-8334-2020; Tao, Peng/H-4925-2014","Tian, Hao/0000-0002-0186-9811; Tao, Peng/0000-0002-2488-0239",National Institute of General Medical Sciences of the National Institutes of HealthUnited States Department of Health & Human ServicesNational Institutes of Health (NIH) - USANIH National Institute of General Medical Sciences (NIGMS) [R15GM122013],Research reported in this paper was supported by the National Institute of General Medical Sciences of the National Institutes of Health under Award No. R15GM122013.,,39,1,1,3,3,TAYLOR & FRANCIS INC,PHILADELPHIA,"530 WALNUT STREET, STE 850, PHILADELPHIA, PA 19106 USA",0739-1102,1538-0254,,J BIOMOL STRUCT DYN,J. Biomol. Struct. Dyn.,,,,,,,,,,,,10.1080/07391102.2020.1802338,,AUG 2020,8,Biochemistry & Molecular Biology; Biophysics,Biochemistry & Molecular Biology; Biophysics,MT8IB,WOS:000555210700001,32746720,"Bronze, Green Published",,,2020-11-19,
J,"Raghunathan, S; Yadav, K; Rojisha, VC; Jaganade, T; Prathyusha, V; Bikkina, S; Lourderaj, U; Priyakumar, UD",,,,"Raghunathan, Shampa; Yadav, Komal; Rojisha, V. C.; Jaganade, Tanashree; Prathyusha, V; Bikkina, Swetha; Lourderaj, Upakarasamy; Priyakumar, U. Deva",,,Transition between [R]- and [S]-stereoisomers without bond breaking,PHYSICAL CHEMISTRY CHEMICAL PHYSICS,,,English,Article,,,,,,,PLANAR-TETRACOORDINATE CARBON; HEXACOORDINATE CARBON; MOLECULES; ENERGY; DESIGN; PENTACOORDINATE; MODELS; ATOM,"The fifty-year old proposal of a nondissociative racemization reaction of a tetracoordinated tetrahedral center from one enantiomer to anotherviaa planar transition state by Hoffmann and coworkers has been explored by many research groups over the past five decades. A number of stable molecules with planar tetracoordinated and higher-coordinated centers have been designed and experimentally realized; however, there has not been a single example of a molecular system that can possibly undergo such racemization. Here we show examples of molecular species that undergo inversion of stereochemistry around tetrahedral centers (Si, Al(-)and P+) eitherviaa planar transition state or an intermediate state using quantum mechanical,ab initioquasi-classical dynamics calculations, and Born-Oppenheimer molecular dynamics (BOMD) simulations. This work is expected to provide potential leads for future studies on this fundamental phenomenon in chemistry.","[Raghunathan, Shampa; Rojisha, V. C.; Jaganade, Tanashree; Prathyusha, V; Bikkina, Swetha; Priyakumar, U. Deva] Int Inst Informat Technol, Ctr Computat Nat Sci & Bioinformat, Hyderabad 500032, India; [Yadav, Komal; Lourderaj, Upakarasamy] HBNI, Natl Inst Sci Educ & Res, Sch Chem Sci, PO Jatani, Khordha 752050, India","Priyakumar, UD (corresponding author), Int Inst Informat Technol, Ctr Computat Nat Sci & Bioinformat, Hyderabad 500032, India.; Lourderaj, U (corresponding author), HBNI, Natl Inst Sci Educ & Res, Sch Chem Sci, PO Jatani, Khordha 752050, India.",u.lourderaj@niser.ac.in; deva@iiit.ac.in,"Raghunathan, Shampa/ABA-6573-2020","Jaganade, Tanashree/0000-0003-0846-2464; Raghunathan, Shampa/0000-0002-8872-4411; Rojisha, V C/0000-0002-0622-895X","DST-SERBDepartment of Science & Technology (India)Science Engineering Research Board (SERB), India [PDF/2018/000142, EMR/2016/007697]","We thank Prof. Roald Hoffmann, Prof. Gernot Frenking and Prof. G. Narahari Sastry for fruitful discussions, and Dr Semparithi Aravindan for his help in making the movie included in the supporting information. UDP thanks DST-SERB (Grant No. EMR/2016/007697) for financial assistance. SR thanks DST-SERB (Grant No. PDF/2018/000142) for the National Postdoctoral Fellowship.",,69,1,1,3,3,ROYAL SOC CHEMISTRY,CAMBRIDGE,"THOMAS GRAHAM HOUSE, SCIENCE PARK, MILTON RD, CAMBRIDGE CB4 0WF, CAMBS, ENGLAND",1463-9076,1463-9084,,PHYS CHEM CHEM PHYS,Phys. Chem. Chem. Phys.,JUL 14,2020,22,26,,,,,14983,14991,,10.1039/d0cp02918a,,,9,"Chemistry, Physical; Physics, Atomic, Molecular & Chemical",Chemistry; Physics,MG9IT,WOS:000546347000056,32588839,,,,2020-11-19,
