J,"Dibak, M; del Razo, MJ; De Sancho, D; Schutte, C; Noe, F",,,,"Dibak, Manuel; del Razo, Mauricio J.; De Sancho, David; Schuette, Christof; Noe, Frank",,,MSM/RD: Coupling Markov state models of molecular kinetics with reaction-diffusion simulations,JOURNAL OF CHEMICAL PHYSICS,,,English,Article,,,,,,,DYNAMICS SIMULATIONS; VARIATIONAL APPROACH; REDUCTION; INHIBITOR; BINDING; MAPS,"Molecular dynamics (MD) simulations can model the interactions between macromolecules with high spatiotemporal resolution but at a high computational cost. By combining high-throughput MD with Markov state models (MSMs), it is now possible to obtain long time-scale behavior of small to intermediate biomolecules and complexes. To model the interactions of many molecules at large length scales, particle-based reaction-diffusion (RD) simulations are more suitable but lack molecular detail. Thus, coupling MSMs and RD simulations (MSM/RD) would be highly desirable, as they could efficiently produce simulations at large time and length scales, while still conserving the characteristic features of the interactions observed at atomic detail. While such a coupling seems straightforward, fundamental questions are still open: Which definition of MSM states is suitable? Which protocol to merge and split RD particles in an association/dissociation reaction will conserve the correct bimolecular kinetics and thermodynamics? In this paper, we make the first step toward MSM/RD by laying out a general theory of coupling and proposing a first implementation for association/dissociation of a protein with a small ligand (A + B reversible arrow C). Applications on a toy model and CO diffusion into the heme cavity of myoglobin are reported. Published by AIP Publishing.","[Dibak, Manuel; del Razo, Mauricio J.; Schuette, Christof; Noe, Frank] Free Univ Berlin, Dept Math & Comp Sci, Arnimallee 6, D-14195 Berlin, Germany; [De Sancho, David] Euskal Herriko Unibertsitatea UPV EHU, Kimika Fak, PK 1072, Donostia San Sebastian 20080, Euskadi, Spain; [De Sancho, David] DIPC, PK 1072, Donostia San Sebastian 20080, Euskadi, Spain","Noe, F (corresponding author), Free Univ Berlin, Dept Math & Comp Sci, Arnimallee 6, D-14195 Berlin, Germany.",frank.noe@fu-berlin.de,"Noe, Frank/Y-2766-2019; del Razo, Mauricio J/J-9430-2018","del Razo, Mauricio J/0000-0002-9747-790X; Noe, Frank/0000-0003-4169-9324","Deutsche ForschungsgemeinschaftGerman Research Foundation (DFG) [SFB1114, C03, A04]; Einstein Foundation Berlin (ECMath) [CH17]; European Research Council (ERC)European Research Council (ERC) [307494]; Spanish Ministry of Economy, Industry and Competitiveness (MINECO) [CTQ2015-65320-R, RYC-2016-19590]","We gratefully acknowledge support by the Deutsche Forschungsgemeinschaft (Grant No. SFB1114, Project Nos. C03 and A04), the Einstein Foundation Berlin (ECMath Grant No. CH17), and the European Research Council (ERC starting Grant No. 307494 pcCell). David De Sancho was supported by Grant Nos. CTQ2015-65320-R and RYC-2016-19590 from the Spanish Ministry of Economy, Industry and Competitiveness (MINECO). We also thank Tim Hempel and Nuria Plattner for helpful discussions and software tutorials.",,76,10,10,1,16,AMER INST PHYSICS,MELVILLE,"1305 WALT WHITMAN RD, STE 300, MELVILLE, NY 11747-4501 USA",0021-9606,1089-7690,,J CHEM PHYS,J. Chem. Phys.,JUN 7,2018,148,21,,,,,,,214107,10.1063/1.5020294,,,13,"Chemistry, Physical; Physics, Atomic, Molecular & Chemical",Chemistry; Physics,GI9IE,WOS:000434837600009,29884049,,,,2020-11-19,
J,"Sultan, MM; Pande, VS",,,,"Sultan, Mohammad M.; Pande, Vijay S.",,,Transfer Learning from Markov Models Leads to Efficient Sampling of Related Systems,JOURNAL OF PHYSICAL CHEMISTRY B,,,English,Article,,,,,,,MOLECULAR-DYNAMICS SIMULATION; FORCE-FIELD; METADYNAMICS; PERMEATION; KINETICS,"We recently showed that the time-structure-based independent component analysis method from Markov state model literature provided a set of variationally optimal slow collective variables for metadynamics (tICA-metady-namics). In this paper, we extend the methodology toward efficient sampling of related mutants by borrowing ideas from transfer learning methods in machine learning. Our method explicitly assumes that a similar set of slow modes and metastable states is found in both the wild type (baseline) and its mutants. Under this assumption, we describe a few simple techniques using sequence mapping for transferring the slow modes and structural information contained in the wild type simulation to a mutant model for performing enhanced sampling. The resulting simulations can then be reweighted onto the full-phase space using the multistate Bennett acceptance ratio, allowing for thermodynamic comparison against the wild type. We first benchmark our methodology by recapturing alanine dipeptide dynamics across a range of different atomistic force fields, including the polarizable Amoeba force field, after learning a set of slow modes using Amber ff99sb-ILDN. We next extend the method by including structural data from the wild type simulation and apply the technique to recapturing the effects of the GTT mutation on the FIP35 WW domain.","[Sultan, Mohammad M.; Pande, Vijay S.] Stanford Univ, Dept Chem, 318 Campus Dr, Stanford, CA 94305 USA","Pande, VS (corresponding author), Stanford Univ, Dept Chem, 318 Campus Dr, Stanford, CA 94305 USA.",Pande@stanford.edu,,,National Science FoundationNational Science Foundation (NSF) [NSF-MCB-0954714]; National Science Foundation Major Research Instrumentation programNational Science Foundation (NSF)NSF - Directorate for Mathematical & Physical Sciences (MPS) [ACI-1429830]; Office of Advanced Cyberinfrastructure (OAC)National Science Foundation (NSF)NSF - Directorate for Computer & Information Science & Engineering (CISE) [1429830] Funding Source: National Science Foundation,"The authors would like to thank various members of the Pande lab for useful discussions and feedback on the manuscript. M.M.S. would like to acknowledge the authors from ref 41 for their help regarding reweighting of the metadynamics simulations. M.M.S. would like to acknowledge support from the National Science Foundation grant NSF-MCB-0954714. This work used the XStream computational resource, supported by the National Science Foundation Major Research Instrumentation program (ACI-1429830).",,49,10,10,1,15,AMER CHEMICAL SOC,WASHINGTON,"1155 16TH ST, NW, WASHINGTON, DC 20036 USA",1520-6106,,,J PHYS CHEM B,J. Phys. Chem. B,MAY 31,2018,122,21,,,SI,,5291,5299,,10.1021/acs.jpcb.7b06896,,,9,"Chemistry, Physical",Chemistry,GI2YD,WOS:000434236900004,28938073,,,,2020-11-19,
J,"Amaro, RE; Baudry, J; Chodera, J; Demir, O; McCammon, JA; Miao, YL; Smith, JC",,,,"Amaro, Rommie E.; Baudry, Jerome; Chodera, John; Demir, Ozlem; McCammon, J. Andrew; Miao, Yinglong; Smith, Jeremy C.",,,Ensemble Docking in Drug Discovery,BIOPHYSICAL JOURNAL,,,English,Review,,,,,,,ACCELERATED MOLECULAR-DYNAMICS; MARKOV STATE MODELS; RECEPTOR FLEXIBILITY; INDUCED FIT; PROTEIN; SIMULATION; INHIBITORS; DESIGN; SOFTWARE; POTENT,"Ensemble docking corresponds to the generation of an ensemble'' of drug target conformations in computational structure-based drug discovery, often obtained by using molecular dynamics simulation, that is used in docking candidate ligands. This approach is now well established in the field of early-stage drug discovery. This review gives a historical account of the development of ensemble docking and discusses some pertinent methodological advances in conformational sampling.","[Amaro, Rommie E.; Demir, Ozlem; McCammon, J. Andrew] Univ Calif San Diego, Dept Chem & Biochem, La Jolla, CA 92093 USA; [Baudry, Jerome] Univ Alabama, Huntsville, AL 35899 USA; [Chodera, John] Univ Calif Berkeley, Berkeley, CA 94720 USA; [Miao, Yinglong] Univ Kansas, Dept Computat Biol & Mol Biosci, Lawrence, KS 66045 USA; [Smith, Jeremy C.] Oak Ridge Natl Lab, UT ORNL Ctr Mol Biophys, Oak Ridge, TN 37830 USA; [Smith, Jeremy C.] Univ Tennessee, Dept Biochem & Cellular & Mol Biol, Knoxville, TN 37996 USA","Smith, JC (corresponding author), Oak Ridge Natl Lab, UT ORNL Ctr Mol Biophys, Oak Ridge, TN 37830 USA.; Smith, JC (corresponding author), Univ Tennessee, Dept Biochem & Cellular & Mol Biol, Knoxville, TN 37996 USA.",smithjc@ornl.gov,"smith, jeremy c/B-7287-2012","smith, jeremy c/0000-0002-2978-3227","National Institutes of HealthUnited States Department of Health & Human ServicesNational Institutes of Health (NIH) - USA [1KL2RR031974-01, NIAMS 01AI052293, GM31749, GM103426]; Laboratory-Directed Research and Development Grant from the Department of Energy; San Diego Supercomputer Center; American Heart AssociationAmerican Heart Association [17SDG33370094]; NATIONAL INSTITUTE OF ALLERGY AND INFECTIOUS DISEASESUnited States Department of Health & Human ServicesNational Institutes of Health (NIH) - USANIH National Institute of Allergy & Infectious Diseases (NIAID) [R01AI052293, R01AI052293, R01AI052293, R01AI052293, R01AI052293, R01AI052293, R01AI052293, R01AI052293, R01AI052293, R01AI052293, R01AI052293, R01AI052293, R01AI052293, R01AI052293, R01AI052293, R01AI052293] Funding Source: NIH RePORTER; NATIONAL INSTITUTE OF GENERAL MEDICAL SCIENCESUnited States Department of Health & Human ServicesNational Institutes of Health (NIH) - USANIH National Institute of General Medical Sciences (NIGMS) [R01GM031749, R01GM031749, P41GM103426, P41GM103426, R01GM031749] Funding Source: NIH RePORTER","Work in the J.C.S. and J.B. groups is supported by the National Institutes of Health (1KL2RR031974-01 and NIAMS 01AI052293) and a Laboratory-Directed Research and Development Grant from the Department of Energy, in the J.A.M. group by the National Institutes of Health (GM31749 and GM103426) and the San Diego Supercomputer Center, and in the Y.M. group by the American Heart Association (17SDG33370094).",,66,66,67,2,32,CELL PRESS,CAMBRIDGE,"50 HAMPSHIRE ST, FLOOR 5, CAMBRIDGE, MA 02139 USA",0006-3495,1542-0086,,BIOPHYS J,Biophys. J.,MAY 22,2018,114,10,,,,,2271,2278,,10.1016/j.bpj.2018.02.038,,,8,Biophysics,Biophysics,GG4XT,WOS:000432700300005,29606412,"Green Published, Bronze",Y,N,2020-11-19,
J,"Chong, SH; Ham, S",,,,"Chong, Song-Ho; Ham, Sihyun",,,Examining a Thermodynamic Order Parameter of Protein Folding,SCIENTIFIC REPORTS,,,English,Article,,,,,,,MOLECULAR-DYNAMICS SIMULATIONS; MARKOV STATE MODELS; ENERGY LANDSCAPE; BINDING; CONFORMATION; TOPOGRAPHY; PATHWAYS; KINETICS; ROBUST; VIEW,"Dimensionality reduction with a suitable choice of order parameters or reaction coordinates is commonly used for analyzing high-dimensional time-series data generated by atomistic biomolecular simulations. So far, geometric order parameters, such as the root mean square deviation, fraction of native amino acid contacts, and collective coordinates that best characterize rare or large conformational transitions, have been prevailing in protein folding studies. Here, we show that the solvent-averaged effective energy, which is a thermodynamic quantity but unambiguously defined for individual protein conformations, serves as a good order parameter of protein folding. This is illustrated through the application to the folding-unfolding simulation trajectory of villin headpiece subdomain. We rationalize the suitability of the effective energy as an order parameter by the funneledness of the underlying protein free energy landscape. We also demonstrate that an improved conformational space discretization is achieved by incorporating the effective energy. The most distinctive feature of this thermodynamic order parameter is that it works in pointing to near-native folded structures even when the knowledge of the native structure is lacking, and the use of the effective energy will also find applications in combination with methods of protein structure prediction.","[Chong, Song-Ho; Ham, Sihyun] Sookmyung Womens Univ, Dept Chem, Cheongpa Ro 47 Gil 100, Seoul 04310, South Korea","Ham, S (corresponding author), Sookmyung Womens Univ, Dept Chem, Cheongpa Ro 47 Gil 100, Seoul 04310, South Korea.",sihyun@sookmyung.ac.kr,,,"Basic Science Research Program through the National Research Foundation of Korea (NRF) - Ministry of Education, Science and Technology [NRF-2015R1D1A1A01058341, 2017R1A2B3010053]","This research was supported by Basic Science Research Program through the National Research Foundation of Korea (NRF) funded by the Ministry of Education, Science and Technology (Nos NRF-2015R1D1A1A01058341 and 2017R1A2B3010053). We thank the D. E. Shaw Research for providing us the simulation trajectories of HP35 and FiP35.",,50,3,3,0,5,NATURE PUBLISHING GROUP,LONDON,"MACMILLAN BUILDING, 4 CRINAN ST, LONDON N1 9XW, ENGLAND",2045-2322,,,SCI REP-UK,Sci Rep,MAY 8,2018,8,,,,,,,,7148,10.1038/s41598-018-25406-8,,,9,Multidisciplinary Sciences,Science & Technology - Other Topics,GF0MB,WOS:000431623800018,29740018,"DOAJ Gold, Green Published",,,2020-11-19,
J,"Matsunaga, Y; Sugita, Y",,,,"Matsunaga, Yasuhiro; Sugita, Yuji",,,Linking time-series of single-molecule experiments with molecular dynamics simulations by machine learning,ELIFE,,,English,Article,,,,,,,ENHANCED SAMPLING ALGORITHMS; PROTEIN-FOLDING SIMULATIONS; FORCE-FIELD; WW DOMAIN; DISORDERED PROTEIN; MODEL SELECTION; HYBRID-PARALLEL; MARKOV MODEL; FRET; DIFFUSION,"Single-molecule experiments and molecular dynamics (MD) simulations are indispensable tools for investigating protein conformational dynamics. The former provide time series data, such as donor-acceptor distances, whereas the latter give atomistic information, although this information is often biased by model parameters. Here, we devise a machine-learning method to combine the complementary information from the two approaches and construct a consistent model of conformational dynamics. It is applied to the folding dynamics of the forminbinding protein WW domain. MD simulations over 400 mu s led to an initial Markov state model (MSM), which was then refined using single-molecule Forster resonance energy transfer (FRET) data through hidden Markov modeling. The refined or data-assimilated MSM reproduces the FRET data and features hairpin one in the transition-state ensemble, consistent with mutation experiments. The folding pathway in the data-assimilated MSM suggests interplay between hydrophobic contacts and turn formation. Our method provides a general framework for investigating conformational transitions in other proteins.","[Matsunaga, Yasuhiro; Sugita, Yuji] RIKEN Ctr Computat Sci, Computat Biophys Res Team, Kobe, Hyogo, Japan; [Matsunaga, Yasuhiro] JST PRESTO, Kawaguchi, Japan; [Sugita, Yuji] RIKEN Cluster Pioneering Res, Theoret Mol Sci Lab, Wako, Saitama, Japan; [Sugita, Yuji] RIKEN Ctr Biosyst Dynam Res, Lab Biomol Funct Simulat, Kobe, Hyogo, Japan","Sugita, Y (corresponding author), RIKEN Ctr Computat Sci, Computat Biophys Res Team, Kobe, Hyogo, Japan.; Sugita, Y (corresponding author), RIKEN Cluster Pioneering Res, Theoret Mol Sci Lab, Wako, Saitama, Japan.; Sugita, Y (corresponding author), RIKEN Ctr Biosyst Dynam Res, Lab Biomol Funct Simulat, Kobe, Hyogo, Japan.",sugita@riken.jp,"Matsunaga, Yasuhiro/C-6774-2016; Sugita, Yuji/L-6726-2014","Matsunaga, Yasuhiro/0000-0003-2872-3908; Sugita, Yuji/0000-0001-9738-9216","Japan Science and Technology AgencyJapan Science & Technology Agency (JST) [JPMJPR1679, JPMJCR13M3]; Ministry of Education, Culture, Sports, Science, and TechnologyMinistry of Education, Culture, Sports, Science and Technology, Japan (MEXT) [26120533, 26119006]; RIKEN; Research Organization for Information Science and Technology [hp160022, ra000009]","Japan Science and Technology Agency JPMJPR1679 Yasuhiro Matsunaga; Ministry of Education, Culture, Sports, Science, and Technology 26120533 Yasuhiro Matsunaga; RIKEN Dynamic Structural Biology Yuji Sugita; Research Organization for Information Science and Technology hp160022 Yasuhiro Matsunaga Yuji Sugita; Japan Science and Technology Agency JPMJCR13M3 Yuji Sugita; Ministry of Education, Culture, Sports, Science, and Technology 26119006 Yuji Sugita; Research Organization for Information Science and Technology ra000009 Yasuhiro Matsunaga Yuji Sugita; The funders had no role in study design, data collection and interpretation, or the decision to submit the work for publication.",,93,8,8,0,17,ELIFE SCIENCES PUBLICATIONS LTD,CAMBRIDGE,"SHERATON HOUSE, CASTLE PARK, CAMBRIDGE, CB3 0AX, ENGLAND",2050-084X,,,ELIFE,eLife,MAY 3,2018,7,,,,,,,,e32668,10.7554/eLife.32668,,,19,Biology,Life Sciences & Biomedicine - Other Topics,GE5UQ,WOS:000431288400001,29723137,"DOAJ Gold, Green Published",,,2020-11-19,
J,"Meng, YL; Gao, C; Clawson, DK; Atwell, S; Russell, M; Vieth, M; Roux, B",,,,"Meng, Yilin; Gao, Cen; Clawson, David K.; Atwell, Shane; Russell, Marijane; Vieth, Michal; Roux, Benoit",,,Predicting the Conformational Variability of Abl Tyrosine Kinase using Molecular Dynamics Simulations and Markov State Models,JOURNAL OF CHEMICAL THEORY AND COMPUTATION,,,English,Article,,,,,,,C-SRC; VARIATIONAL APPROACH; CHEMICAL LIBRARIES; FREE-ENERGY; BINDING; DRUG; ACTIVATION; TRANSITION; FLEXIBILITY; INHIBITORS,"Understanding protein conformational variability remains a challenge in drug discovery. The issue arises in protein kinases, whose multiple conformational states can affect the binding of small-molecule inhibitors. To overcome this challenge, we propose a comprehensive computational framework based on Markov state models (MSMs). Our framework integrates the information from explicit-solvent molecular dynamics simulations to accurately rank-order the accessible conformational variants of a target protein. We tested the methodology using Abl kinase with a reference and blind-test set. Only half of the Abl conformational variants discovered by our approach are present in the disclosed X-ray structures. The approach successfully identified a protein conformational state not previously observed in public structures but evident in a retrospective analysis of Lilly in-house structures: the X-ray structure of Abl with WHI-P154. Using a MSM-derived model, the free energy landscape and kinetic profile of Abl was analyzed in detail highlighting opportunities for targeting the unique metastable states.","[Meng, Yilin; Roux, Benoit] Univ Chicago, Dept Biochem & Mol Biol, Chicago, IL 60637 USA; [Gao, Cen; Clawson, David K.] Eli Lilly & Co, Lilly Corp Ctr, Discovery Chem Res & Technol, Indianapolis, IN 46285 USA; [Atwell, Shane] Eli Lilly & Co, Appl Mol Evolut, Lilly Biotechnol Ctr, 10290 Campus Point Dr, San Diego, CA 92121 USA; [Russell, Marijane; Vieth, Michal] Eli Lilly & Co, Discovery Chem Res & Technol, Lilly Biotechnol Ctr, 10290 Campus Point Dr, San Diego, CA 92121 USA; [Meng, Yilin] Pfizer Inc, Worldwide Res & Dev, Med Sci, Eastern Point Rd, Groton, CT 06340 USA","Roux, B (corresponding author), Gordon Ctr Integrat Sci, 929 E 57th St,Room W323B, Chicago, IL USA.",roux@uchicago.edu,,"Roux, Benoit/0000-0002-5254-2712","National Cancer Institute (NCI) of the National Institutes of Health (NIH)United States Department of Health & Human ServicesNational Institutes of Health (NIH) - USANIH National Cancer Institute (NCI) [R01-CAO93577]; Eli Lilly & Co. Lilly Research Award Program (LRAP); Argonne National LaboratoryUnited States Department of Energy (DOE)University of Chicago [S10 RR029030-01]; Extreme Science and Engineering Discovery Environment (XSEDE) grant [OCI-1053575]; DOE Office of ScienceUnited States Department of Energy (DOE) [DE-AC02-06CH11357]; NATIONAL CANCER INSTITUTEUnited States Department of Health & Human ServicesNational Institutes of Health (NIH) - USANIH National Cancer Institute (NCI) [R01CA093577, R01CA093577, R01CA093577, R01CA093577, R01CA093577, R01CA093577, R01CA093577, R01CA093577, R01CA093577, R01CA093577, R01CA093577, R01CA093577, R01CA093577, R01CA093577, R01CA093577] Funding Source: NIH RePORTER; NATIONAL CENTER FOR RESEARCH RESOURCESUnited States Department of Health & Human ServicesNational Institutes of Health (NIH) - USANIH National Center for Research Resources (NCRR) [S10RR029030] Funding Source: NIH RePORTER","This work is supported by the National Cancer Institute (NCI) of the National Institutes of Health (NIH) through grant R01-CAO93577 and Eli Lilly & Co. Lilly Research Award Program (LRAP). The computations are supported in part by NIH through resources provided by the Computation Institute and the Biological Sciences Division of the University of Chicago and Argonne National Laboratory under grant S10 RR029030-01, by the Extreme Science and Engineering Discovery Environment (XSEDE) grant number OCI-1053575, and by the University of Chicago Research Computing Center. The authors gratefully acknowledge Hal Lewis for an initial structure and maps. This research used resources of the Advanced Photon Source, a U.S. Department of Energy (DOE) Office of Science User Facility, operated for the DOE Office of Science by Argonne National Laboratory under Contract No. DE-AC02-06CH11357. Use of the Lilly Research Laboratories Collaborative Access Team (LRL-CAT) beamline at Sector 31 of the Advanced Photon Source was provided by Eli Lilly Company, which operates the facility.",,78,14,13,1,18,AMER CHEMICAL SOC,WASHINGTON,"1155 16TH ST, NW, WASHINGTON, DC 20036 USA",1549-9618,1549-9626,,J CHEM THEORY COMPUT,J. Chem. Theory Comput.,MAY,2018,14,5,,,,,2721,2732,,10.1021/acs.jctc.7b01170,,,12,"Chemistry, Physical; Physics, Atomic, Molecular & Chemical",Chemistry; Physics,GF4IN,WOS:000431926500040,29474075,Green Accepted,,,2020-11-19,
J,"Sultan, MM; Wayment-Steele, HK; Pande, VS",,,,"Sultan, Mohammad M.; Wayment-Steele, Hannah K.; Pande, Vijay S.",,,Transferable Neural Networks for Enhanced Sampling of Protein Dynamics,JOURNAL OF CHEMICAL THEORY AND COMPUTATION,,,English,Article,,,,,,,PATHWAYS; KINETICS,"Variational autoencoder frameworks have demonstrated success in reducing complex nonlinear dynamics in molecular simulation to a single nonlinear embedding. In this work, we illustrate how this nonlinear latent embedding can be used as a collective variable for enhanced sampling and present a simple modification that allows us to rapidly perform sampling in multiple related systems. We first demonstrate our method is able to describe the effects of force field changes in capped alanine dipeptide after learning about a model using AMBER99. We further provide a simple extension to variational dynamics encoders that allows the model to be trained in a more efficient manner on larger systems by encoding the outputs of a linear transformation using time-structure based independent component analysis (tICA). Using this technique, we show how such a model trained for one protein, the WW domain, can efficiently be transferred to perform enhanced sampling on a related mutant protein, the GTT mutation. This method shows promise for its ability to rapidly sample related systems using a single transferable collective variable, enabling us to probe the effects of variation in increasingly large systems of biophysical interest.","[Sultan, Mohammad M.; Wayment-Steele, Hannah K.] Stanford Univ, Dept Chem, 318 Campus Dr, Stanford, CA 94305 USA; [Pande, Vijay S.] Stanford Univ, Dept Bioengn, 318 Campus Dr, Stanford, CA 94305 USA","Pande, VS (corresponding author), Stanford Univ, Dept Bioengn, 318 Campus Dr, Stanford, CA 94305 USA.",pande@stanford.edu,,,NSF GFRP; National Science Foundation Major Research Instrumentation programNational Science Foundation (NSF)NSF - Directorate for Mathematical & Physical Sciences (MPS) [ACI-1429830];  [NSF-MCB-0954714]; Office of Advanced Cyberinfrastructure (OAC)National Science Foundation (NSF)NSF - Directorate for Computer & Information Science & Engineering (CISE) [1429830] Funding Source: National Science Foundation,"M.M.S. acknowledges support from NSF-MCB-0954714. H.K.W.S. acknowledges support from the NSF GFRP. This work used the XStream computational resource, supported by the National Science Foundation Major Research Instrumentation program (ACI-1429830).",,53,31,31,4,20,AMER CHEMICAL SOC,WASHINGTON,"1155 16TH ST, NW, WASHINGTON, DC 20036 USA",1549-9618,1549-9626,,J CHEM THEORY COMPUT,J. Chem. Theory Comput.,APR,2018,14,4,,,,,1887,1894,,10.1021/acs.jctc.8b00025,,,8,"Chemistry, Physical; Physics, Atomic, Molecular & Chemical",Chemistry; Physics,GC8DM,WOS:000430023200007,29529369,,,,2020-11-19,
