J,"de Sancho, D; Aguirre, A",,,,"de Sancho, David; Aguirre, Anne",,,MasterMSM: A Package for Constructing Master Equation Models of Molecular Dynamics,JOURNAL OF CHEMICAL INFORMATION AND MODELING,,,English,Article,,,,,,,MARKOV STATE MODELS; FOLDING KINETICS; FORCE-FIELD; SIMULATIONS; TRANSITION; HAIRPIN,"Markov state models (MSMs) have become one of the most important techniques for understanding biomolecular transitions from classical molecular dynamics (MD) simulations. MSMs provide a systematized way of accessing the long time kinetics of the system of interest from the short-time scale microscopic transitions observed in simulation trajectories. At the same time, they provide a consistent description of the equilibrium and dynamical properties of the system of interest, and they are ideally suited for comparisons against experiment. A few software packages exist for building MSMs, which have been widely adopted. Here we introduce MasterMSM, a new Python package that uses the master equation formulation of MSMs and provides a number of new algorithms for building and analyzing these models. We demonstrate some of the most distinctive features of the package, including the estimation of rates, definition of core-sets for transition based assignment of states, the estimation of committors and fluxes, and the sensitivity analysis of the emerging networks. The package is available at https://github.com/daviddesancho/MasterMSM.","[de Sancho, David] Univ Basque Country, Fac Chem, Paseo Manuel Lardizabal 3, Donostia San Sebastian 20018, Spain; [de Sancho, David; Aguirre, Anne] Donostia Int Phys Ctr, Donostia San Sebastian 20018, Spain","de Sancho, D (corresponding author), Univ Basque Country, Fac Chem, Paseo Manuel Lardizabal 3, Donostia San Sebastian 20018, Spain.; de Sancho, D (corresponding author), Donostia Int Phys Ctr, Donostia San Sebastian 20018, Spain.",david.desancho@ehu.eus,"De Sancho, David/C-4995-2009","De Sancho, David/0000-0002-8985-2685","Ministry of Science, Research and Universities [CTQ2015-65320-R, RYC-2016-19590]; Basque GovernmentBasque Government [IT1254-19]; Ikerbasque Research Fellowship; DIPC","D.d.S. would like to thank Robert B. Best, Nicolai-Viorel Buchete, Frank Noe, Edina Rosta, Jacob Stevenson, and William Jacobs for helpful discussions. This work was supported by Grants CTQ2015-65320-R and RYC-2016-19590 from the Ministry of Science, Research and Universities, Grant IT1254-19 from the Basque Government. and an Ikerbasque Research Fellowship to D.d.S. A.A. acknowledges financial support from DIPC.",,31,2,2,0,4,AMER CHEMICAL SOC,WASHINGTON,"1155 16TH ST, NW, WASHINGTON, DC 20036 USA",1549-9596,1549-960X,,J CHEM INF MODEL,J. Chem Inf. Model.,SEP,2019,59,9,,,,,3625,3629,,10.1021/acs.jcim.9b00468,,,5,"Chemistry, Medicinal; Chemistry, Multidisciplinary; Computer Science, Information Systems; Computer Science, Interdisciplinary Applications",Pharmacology & Pharmacy; Chemistry; Computer Science,JA4AD,WOS:000487769800007,31423789,,,,2020-11-19,
J,"Chen, W; Sidky, H; Ferguson, AL",,,,"Chen, Wei; Sidky, Hythem; Ferguson, Andrew L.",,,Capabilities and limitations of time-lagged autoencoders for slow mode discovery in dynamical systems,JOURNAL OF CHEMICAL PHYSICS,,,English,Article,,,,,,,MARKOV STATE MODELS; VARIATIONAL APPROACH; SIMULATIONS; REDUCTION; OPERATOR; MAPS,"Time-lagged autoencoders (TAEs) have been proposed as a deep learning regression-based approach to the discovery of slow modes in dynamical systems. However, a rigorous analysis of nonlinear TAEs remains lacking. In this work, we discuss the capabilities and limitations of TAEs through both theoretical and numerical analyses. Theoretically, we derive bounds for nonlinear TAE performance in slow mode discovery and show that in general TAEs learn a mixture of slow and maximum variance modes. Numerically, we illustrate cases where TAEs can and cannot correctly identify the leading slowest mode in two example systems: a 2D Washington beltway potential and the alanine dipeptide molecule in explicit water. We also compare the TAE results with those obtained using state-free reversible variational approach for Markov processes nets (SRVs) as a variational-based neural network approach for slow mode discovery and show that SRVs can correctly discover slow modes where TAEs fail. Published under license by AIP Publishing.","[Chen, Wei] Univ Illinois, Dept Phys, 1110 West Green St, Urbana, IL 61801 USA; [Sidky, Hythem; Ferguson, Andrew L.] Univ Chicago, Pritzker Sch Mol Engn, 5640 South Ellis Ave, Chicago, IL 60637 USA","Ferguson, AL (corresponding author), Univ Chicago, Pritzker Sch Mol Engn, 5640 South Ellis Ave, Chicago, IL 60637 USA.",andrewferguson@uchicago.edu,,"Ferguson, Andrew/0000-0002-8829-9726",National Science FoundationNational Science Foundation (NSF) [CHE-1841805]; Molecular Software Sciences Institute (MolSSI) Software Fellows program (NSF) [ACI-1547580],This material is based upon work supported by the National Science Foundation under Grant No. CHE-1841805. H.S. acknowledges support from the Molecular Software Sciences Institute (MolSSI) Software Fellows program (NSF Grant No. ACI-1547580).,,52,5,5,0,5,AMER INST PHYSICS,MELVILLE,"1305 WALT WHITMAN RD, STE 300, MELVILLE, NY 11747-4501 USA",0021-9606,1089-7690,,J CHEM PHYS,J. Chem. Phys.,AUG 14,2019,151,6,,,,,,,64123,10.1063/1.5112048,,,14,"Chemistry, Physical; Physics, Atomic, Molecular & Chemical",Chemistry; Physics,IR5DE,WOS:000481452400043,,,,,2020-11-19,
J,"Lu, SY; Ni, D; Wang, CX; He, XH; Lin, HW; Wang, Z; Zhang, J",,,,"Lu, Shaoyong; Ni, Duan; Wang, Chengxiang; He, Xinheng; Lin, Houwen; Wang, Zheng; Zhang, Jian",,,Deactivation Pathway of Ras GTPase Underlies Conformational Substates as Targets for Drug Design,ACS CATALYSIS,,,English,Article,,,,,,deactivation; allosteric; conformational transitions; conformational landscapes; molecular dynamics simulations; transition pathway; substates,MARKOV STATE MODELS; STRUCTURAL BASIS; ALLOSTERIC MODULATION; PROTEIN; INHIBITORS; MECHANISM; ACTIVATION; TRANSITION; DISCOVERY; DYNAMICS,"Aberrant activation of Ras GTPase is closely associated with human cancers. Mechanistic and structural insights into conformational transitions underlying the Ras deactivation pathway provide opportunities for the development of targeted therapies for the treatment of Ras-driven cancers. It remains challenging, however, to completely capture a large-scale conformational transition by atomistic molecular dynamics (MD) simulations. Here, we carry out a computational scheme that combines a transition pathway generation algorithm, extensive MD simulations, and Markov state model analysis for disclosing the conformational landscape of the Ras deactivation pathway. Our findings suggest a stepwise deactivation pathway for Ras hydrolysis and identify several key conformational substates along the deactivation pathway. Furthermore, we discover an unexplored and potentially allosteric binding site on the effector-binding region of Ras in the conformational substates, which is further supported by site-directed mutagenesis experiments. This site could be exploited to the design of Ras inhibitors to block Ras-effector interactions.","[Lu, Shaoyong; Ni, Duan; Wang, Chengxiang; He, Xinheng; Zhang, Jian] Shanghai Jiao Tong Univ, Clin & Fundamental Res Ctr, Key Lab Cell Differentiat & Apoptosis, Chinese Minist Educ,Dept Pharm,Renji Hosp,Sch Med, Shanghai 200127, Peoples R China; [Lin, Houwen] Shanghai Jiao Tong Univ, State Key Lab Oncogenes & Related Genes, Res Ctr Marine Drugs, Dept Pharm,Renji Hosp,Sch Med, Shanghai 200127, Peoples R China; [Wang, Zheng] Shanghai Jiao Tong Univ, Dept Gastrointestinal Surg, Renji Hosp, Sch Med, Shanghai 200127, Peoples R China","Lu, SY; Zhang, J (corresponding author), Shanghai Jiao Tong Univ, Clin & Fundamental Res Ctr, Key Lab Cell Differentiat & Apoptosis, Chinese Minist Educ,Dept Pharm,Renji Hosp,Sch Med, Shanghai 200127, Peoples R China.; Wang, Z (corresponding author), Shanghai Jiao Tong Univ, Dept Gastrointestinal Surg, Renji Hosp, Sch Med, Shanghai 200127, Peoples R China.",lushaoyong@yeah.net; wangzh1972@126.com; jian.zhang@sjtu.edu.cn,,"Ni, Duan/0000-0002-3902-2843; He, Xinheng/0000-0001-7813-5480; Lu, Shaoyong/0000-0002-1334-6292; Zhang, Jian/0000-0002-6558-791X; Lin, Hou-Wen/0000-0002-7097-0876","National Natural Science Foundation of ChinaNational Natural Science Foundation of China (NSFC) [21778037, 81603023, 81322046, 81473137]; Innovation Program of Shanghai Municipal Education CommissionInnovation Program of Shanghai Municipal Education Commission [2019-01-07-00-01-E00036]","This work was supported by the National Natural Science Foundation of China (21778037, 81603023, 81322046, 81473137) and the Innovation Program of Shanghai Municipal Education Commission (2019-01-07-00-01-E00036).",,56,12,12,4,18,AMER CHEMICAL SOC,WASHINGTON,"1155 16TH ST, NW, WASHINGTON, DC 20036 USA",2155-5435,,,ACS CATAL,ACS Catal.,AUG,2019,9,8,,,,,7188,7196,,10.1021/acscatal.9b02556,,,17,"Chemistry, Physical",Chemistry,IQ1IO,WOS:000480503700059,,,,,2020-11-19,
J,"Zhao, LK; Ouyang, YH; Li, Q; Zhang, ZQ",,,,"Zhao, Likun; Ouyang, Yanhua; Li, Qian; Zhang, Zhuqing",,,Modulation of p53 N-terminal transactivation domain 2 conformation ensemble and kinetics by phosphorylation,JOURNAL OF BIOMOLECULAR STRUCTURE & DYNAMICS,,,English,Article,,,,,,Phosphorylation; p53 TAD2; molecular dynamics simulations; conformation ensemble; kinetics,INTRINSICALLY DISORDERED PROTEIN; LINEAR CONSTRAINT SOLVER; MARKOV STATE MODELS; SEQUENCE DETERMINANTS; ACTIVATION DOMAIN; BINDING; COMPLEX; PEPTIDE; STABILIZATION; RECOGNITION,"Phosphorylation of protein is critical for various cell processes, which preferentially happens in intrinsically disordered proteins (IDPs). How phosphorylation modulates structural ensemble of disordered peptide remains largely unexplored. Here, using replica exchange molecular dynamics (REMD) and Markov state model (MSM), the conformational distribution and kinetics of p53 N-terminal transactivation domain (TAD) 2 as well as its dual-site phosphorylated form (pSer46, pThr55) were simulated. It reveals that the dual phosphorylation does not change overall size and secondary structure element fraction, while a change in the distribution of hydrogen bonds induces slightly more pre-existing bound helical conformations. MSM analysis indicates that the dual phosphorylation accelerates conformation exchange between disordered and order-like states in target-binding region. It suggests that p53 TAD2 after phosphorylation would be more apt to bind to both the human p62 pleckstrin homology (PH) domain and the yeast tfb1 PH domain through different binding mechanism, where experimentally it exhibits an extended and alpha-helix conformation, respectively, with increased binding strength in both complexes. Our study implies except binding interface, both conformation ensemble and kinetics should be considered for the effects of phosphorylation on IDPs.","[Zhao, Likun; Ouyang, Yanhua; Li, Qian; Zhang, Zhuqing] Univ Chinese Acad Sci, Coll Life Sci, Beijing, Peoples R China","Zhang, ZQ (corresponding author), Univ Chinese Acad Sci, Coll Life Sci, Beijing, Peoples R China.",zhuqingzhang@ucas.ac.cn,"; Zhang, Zhuqing/B-6804-2016","Zhao, Likun/0000-0003-3817-2329; Zhang, Zhuqing/0000-0003-3514-834X","National Science Foundation of ChinaNational Natural Science Foundation of China (NSFC) [21633001, 31870718]","This work was supported by the National Science Foundation of China [Nos. 21633001, 31870718].",,69,1,1,1,12,TAYLOR & FRANCIS INC,PHILADELPHIA,"530 WALNUT STREET, STE 850, PHILADELPHIA, PA 19106 USA",0739-1102,1538-0254,,J BIOMOL STRUCT DYN,J. Biomol. Struct. Dyn.,JUN 12,2020,38,9,,,,,2613,2623,,10.1080/07391102.2019.1637784,,JUL 2019,11,Biochemistry & Molecular Biology; Biophysics,Biochemistry & Molecular Biology; Biophysics,LV5QT,WOS:000474775100001,31248328,,,,2020-11-19,
J,"Chen, W; Sidky, H; Ferguson, AL",,,,"Chen, Wei; Sidky, Hythem; Ferguson, Andrew L.",,,Nonlinear discovery of slow molecular modes using state-free reversible VAMPnets,JOURNAL OF CHEMICAL PHYSICS,,,English,Article,,,,,,,VARIATIONAL APPROACH; NEURAL-NETWORKS; REDUCTION; DYNAMICS; KINETICS; MAPS,"The success of enhanced sampling molecular simulations that accelerate along collective variables (CVs) is predicated on the availability of variables coincident with the slow collective motions governing the long-time conformational dynamics of a system. It is challenging to intuit these slow CVs for all but the simplest molecular systems, and their data-driven discovery directly from molecular simulation trajectories has been a central focus of the molecular simulation community to both unveil the important physical mechanisms and drive enhanced sampling. In this work, we introduce state-free reversible VAMPnets (SRV) as a deep learning architecture that learns nonlinear CV approximants to the leading slow eigenfunctions of the spectral decomposition of the transfer operator that evolves equilibrium-scaled probability distributions through time. Orthogonality of the learned CVs is naturally imposed within network training without added regularization. The CVs are inherently explicit and differentiable functions of the input coordinates making them well-suited to use in enhanced sampling calculations. We demonstrate the utility of SRVs in capturing parsimonious nonlinear representations of complex system dynamics in applications to 1D and 2D toy systems where the true eigenfunctions are exactly calculable and to molecular dynamics simulations of alanine dipeptide and the WW domain protein.","[Chen, Wei] Univ Illinois, Dept Phys, 1110 West Green St, Urbana, IL 61801 USA; [Sidky, Hythem; Ferguson, Andrew L.] Univ Chicago, Inst Mol Engn, 5640 South Ellis Ave, Chicago, IL 60637 USA","Ferguson, AL (corresponding author), Univ Chicago, Inst Mol Engn, 5640 South Ellis Ave, Chicago, IL 60637 USA.",andrewferguson@uchicago.edu,,"Ferguson, Andrew/0000-0002-8829-9726",National Science FoundationNational Science Foundation (NSF) [CHE-1841805]; Molecular Software Sciences Institute (MolSSI) Software Fellows program (NSF) [ACI-1547580],"This material is based on the work supported by the National Science Foundation under Grant No. CHE-1841805. H.S. acknowledges support from the Molecular Software Sciences Institute (MolSSI) Software Fellows program (NSF Grant No. ACI-1547580).<SUP>65,66</SUP> We are grateful to D.E. Shaw Research for sharing the WW domain simulation trajectories.",,66,13,13,3,12,AMER INST PHYSICS,MELVILLE,"1305 WALT WHITMAN RD, STE 300, MELVILLE, NY 11747-4501 USA",0021-9606,1089-7690,,J CHEM PHYS,J. Chem. Phys.,JUN 7,2019,150,21,,,,,,,214114,10.1063/1.5092521,,,16,"Chemistry, Physical; Physics, Atomic, Molecular & Chemical",Chemistry; Physics,IC1NF,WOS:000470725300008,31176319,,,,2020-11-19,
J,"Grazioli, G; Roy, S; Butts, CT",,,,"Grazioli, Gianmarc; Roy, Saswata; Butts, Carter T.",,,Predicting Reaction Products and Automating Reactive Trajectory Characterization in Molecular Simulations with Support Vector Machines,JOURNAL OF CHEMICAL INFORMATION AND MODELING,,,English,Article,,,,,,,MODELS,"A machine learning-based methodology for the prediction of chemical reaction products, along with automated elucidation of mechanistic details via phase space analysis of reactive trajectories, is introduced using low-dimensional heuristic models and then applied to ab initio computer simulations of the photodissociation of acetaldehyde, an important chemical system in atmospheric chemistry. Our method is centered around training Support Vector Machines (SVMs) to identify optimal separatrices that delineate the regions of phase space that lead to different chemical reaction products. In contrast to the more common black box type machine learning methodologies for analyzing chemical simulation data, this SVM-based methodology allows for mechanistic insight to be gleaned from further analysis of the positioning of the phase space points used to train the SVM with respect to the separatrices. For example, a pair of phase space points that are in close proximity to each other but on opposite sides of a separatrix may be situated on opposite sides of a transition state, while phase space points occurring early in a simulation that are distant from a separatrix are likely to belong to trajectories that are highly biased toward the product state associated with the basin of attraction to which they belong. In addition to inferring mechanistic details about multiple-pathway chemical reactions, our method can also be used to increase reactive trajectory sampling efficiency in molecular simulations via rejection sampling, with trajectories leading to undesired product states being identified and terminated early in the simulation rather than being carried to completion.","[Grazioli, Gianmarc; Butts, Carter T.] Univ Calif Irvine, Calif Inst Telecommun & Informat Technol, Irvine, CA 92697 USA; [Grazioli, Gianmarc; Roy, Saswata] Univ Calif Irvine, Dept Chem, Irvine, CA 92697 USA; [Butts, Carter T.] Univ Calif Irvine, Dept Sociol, Irvine, CA 92697 USA; [Butts, Carter T.] Univ Calif Irvine, Dept Stat, Irvine, CA 92697 USA; [Butts, Carter T.] Univ Calif Irvine, Dept EECS, Irvine, CA 92697 USA","Butts, CT (corresponding author), Univ Calif Irvine, Calif Inst Telecommun & Informat Technol, Irvine, CA 92697 USA.; Butts, CT (corresponding author), Univ Calif Irvine, Dept Sociol, Irvine, CA 92697 USA.; Butts, CT (corresponding author), Univ Calif Irvine, Dept Stat, Irvine, CA 92697 USA.; Butts, CT (corresponding author), Univ Calif Irvine, Dept EECS, Irvine, CA 92697 USA.",buttsc@uci.edu,,"Grazioli, Gianmarc/0000-0003-2559-5103",NSFNational Science Foundation (NSF) [DMS-1361425]; DOE Office of Basic Energy SciencesUnited States Department of Energy (DOE) [DE-SC0018352],"C.T.B. and G.G. were supported by NSF award DMS-1361425. S.R. was supported by DOE Office of Basic Energy Sciences award DE-SC0018352. The authors thank Rachel Martin, Yue Yu, and Filipp Furche for their helpful comments on this work.",,31,1,1,0,10,AMER CHEMICAL SOC,WASHINGTON,"1155 16TH ST, NW, WASHINGTON, DC 20036 USA",1549-9596,1549-960X,,J CHEM INF MODEL,J. Chem Inf. Model.,JUN,2019,59,6,,,,,2753,2764,,10.1021/acs.jcim.9b00134,,,12,"Chemistry, Medicinal; Chemistry, Multidisciplinary; Computer Science, Information Systems; Computer Science, Interdisciplinary Applications",Pharmacology & Pharmacy; Chemistry; Computer Science,IF5JG,WOS:000473116500023,31063694,,,,2020-11-19,
